<?xml version="1.0" encoding="UTF-8"?>
<settings
        xmlns:xsi="http://www.w3.org/2001/XMLSchema-instance"
        xsi:schemaLocation="http://www.tvd12.com/schema/ezyfox/settings
          ezy-settings-1.0.0.xsd"
        xmlns="http://www.tvd12.com/schema/ezyfox/settings">

    <node-name>localhost</node-name>
    <max-sessions>30000</max-sessions>

    <thread-pool-size>
        <statistics>1</statistics>
        <stream-handler>8</stream-handler>
        <socket-data-receiver>8</socket-data-receiver>
        <system-request-handler>8</system-request-handler>
        <extension-request-handler>8</extension-request-handler>
        <socket-disconnection-handler>2</socket-disconnection-handler>
        <socket-user-removal-handler>3</socket-user-removal-handler>
    </thread-pool-size>

    <streaming>
        <enable>true</enable>
    </streaming>

    <socket>
        <port>3005</port>
        <address>0.0.0.0</address>
        <active>true</active>
        <ssl-active>true</ssl-active>
        <ssl-type>CUSTOMIZATION</ssl-type>
        <ssl-handshake-timeout>300</ssl-handshake-timeout>
        <tcp-no-delay>true</tcp-no-delay>
        <max-request-size>4096</max-request-size>
        <writer-thread-pool-size>8</writer-thread-pool-size>
        <codec-creator>com.tvd12.ezyfox.codec.MsgPackCodecCreator</codec-creator>
    </socket>

    <udp>
        <port>2611</port>
        <address>0.0.0.0</address>
        <active>true</active>
        <max-request-size>1024</max-request-size>
        <channel-pool-size>8</channel-pool-size>
        <handler-thread-pool-size>5</handler-thread-pool-size>
    </udp>

    <web-socket>
        <port>2208</port>
        <address>0.0.0.0</address>
        <active>true</active>
        <ssl-port>2812</ssl-port>
        <max-frame-size>2048</max-frame-size>
        <min-handler-thread-pool-size>4</min-handler-thread-pool-size>
        <max-handler-thread-pool-size>16</max-handler-thread-pool-size>
        <writer-thread-pool-size>8</writer-thread-pool-size>
        <management-enable>true</management-enable>
        <ssl-active>false</ssl-active>
        <ssl-config>
            <file>ssl-config.properties</file>
            <loader>com.tvd12.ezyfoxserver.ssl.EzySimpleSslConfigLoader</loader>
            <context-factory-builder>com.tvd12.ezyfoxserver.ssl.EzySimpleSslContextFactoryBuilder</context-factory-builder>
        </ssl-config>
        <codec-creator>com.tvd12.ezyfox.codec.JacksonCodecCreator</codec-creator>
    </web-socket>

    <administrators>
        <administrator>
            <username>admin</username>
            <password>admin</password>
            <access-token>admin</access-token>
        </administrator>
    </administrators>

    <session-management>
        <session-max-idle-time>60</session-max-idle-time>
        <session-max-waiting-time>15</session-max-waiting-time>
        <session-max-request-per-second>
            <value>20</value>
            <action>DISCONNECT_SESSION</action>
        </session-max-request-per-second>
    </session-management>

    <event-controllers>
        <event-controller>
            <event-type>SERVER_READY</event-type>
            <controller>com.tvd12.ezyfoxserver.handler.ServerReadyHandler</controller>
        </event-controller>
    </event-controllers>

    <zones>
        <zone>
            <name>example</name>
            <config-file>ezy-zone-settings.xml</config-file>
            <active>true</active>
        </zone>
    </zones>

</settings>

<!-- http://localhost:8080/schema/ezyfox/settings/ -->
